{
  "anomalies": [],
  "artifacts": [],
  "attempt_id": "att_01KDVDNA07SWY7XD5Q8171S2SJ",
  "capability_gates": [
    {
      "gate": "SG-01",
      "status": "NOT_APPLICABLE"
    }
  ],
  "case": "HOOK-LAT-001@2",
  "dimension_results": {},
  "failures": [],
  "gates_triggered": [],
  "measurement_validity": "VALID",
  "outcome": "METRIC_ONLY",
  "repetition": 1,
  "run_id": "run_01KDVDNA01KYPMR3GQXG8A13N0",
  "run_root_hash_after": "sha256:aaaaaaaaaaaaaaaaaaaaaaaaaaaaaaaaaaaaaaaaaaaaaaaaaaaaaaaaaaaaaaaa",
  "run_root_hash_before": "sha256:aaaaaaaaaaaaaaaaaaaaaaaaaaaaaaaaaaaaaaaaaaaaaaaaaaaaaaaaaaaaaaaa",
  "schema": "aebs.attempt/2",
  "session_ids": [
    "sess-synthetic"
  ]
}
